,vteLists of countries by GDP rankings,vteLists of countries by GDP rankings.1
0,Nominal,Per capita Past and projected per capita Sector composition
1,Purchasing power parity(PPP),Per capita Past per capita Past and projected per capita Private consumption per capita Per person employed Ten largest historically 19th century
2,Growth rate,African countries Asian states European Union member states European countries Latin American and Caribbean countries Oceanian countries Per capita 1980–2010 growth Industrial growth
3,Gross national income (GNI),PPP per capita Nominal per capita
4,Countries by region,Africa PPP nominal Commonwealth of Nations PPP nominal Latin America & Caribbean PPP nominal North America PPP nominal nominal per capita South America PPP Arab League nominal and per capita PPP and per capita ASEAN subdivision Asia Asia & Pacific PPP Former Soviet Republics Europe PPP PPP per capita nominal nominal per capita Oceania PPP PPP per capita nominal nominal per capita
5,Subnational divisions,Albania Argentina Australia Austria Baltic States Belarus Belgium Brazil Bulgaria Canada Chile per capita China per capita Colombia Croatia Czech Republic Finland France nominal nominal per capita Germany nominal nominal per capita Greece Hungary India PPP per capita Indonesia per capita Cities Italy nominal per capita Japan per capita Kenya Malaysia Mexico per capita Mongolia Netherlands Nigeria Nepal Norway Pakistan Peru Philippines Poland Portugal Romania Russia per capita Serbia Slovakia South Africa per capita South Korea Spain Sweden Switzerland Ukraine United Kingdom nominal nominal per capita United States nominal per capita Taiwan Tanzania Thailand Turkey Vietnam OECD Top country subdivisions by GDP nominal
6,Lists of countries by financial rankings List of international rankings Lists by country,Lists of countries by financial rankings List of international rankings Lists by country
